{
  "version": "5.0.0",
  "hierarchy": ["official-source", "official-documentation", "observed-behavior", "local-practical-guide", "community-guide", "legacy-ace"],
  "sources": [
    {
      "id": "SRC-ST-WORLD-INFO",
      "title": "SillyTavern world-info.js",
      "url": "https://github.com/SillyTavern/SillyTavern/blob/8172dcd0ee672d3cd9a5e5f7af134f91a45cd2b8/public/scripts/world-info.js",
      "type": "source-code",
      "authority": "official-source",
      "revision": "8172dcd0ee672d3cd9a5e5f7af134f91a45cd2b8",
      "checkedAt": "2026-07-10",
      "reviewDue": "2026-10-08",
      "claims": ["selectiveLogic truth table", "scan depth counts messages", "constant behavior", "order and position", "comment exclusion", "groups and timed effects", "Outlet grouping, sorting, skipping, and non-automatic insertion", "character/global insertion strategy initialization"],
      "ruleIds": ["ACE-LORE-001", "ACE-LORE-002", "ACE-LORE-003", "ACE-KEY-001", "ACE-TOKEN-001", "ACE-SOURCE-001"]
    },
    {
      "id": "SRC-ST-MACROS",
      "title": "SillyTavern macros.js",
      "url": "https://github.com/SillyTavern/SillyTavern/blob/8172dcd0ee672d3cd9a5e5f7af134f91a45cd2b8/public/scripts/macros.js",
      "type": "source-code",
      "authority": "official-source",
      "revision": "8172dcd0ee672d3cd9a5e5f7af134f91a45cd2b8",
      "checkedAt": "2026-07-13",
      "reviewDue": "2026-10-11",
      "claims": ["macro identifiers are case-insensitive", "Outlet names are case-sensitive", "missing Outlet content expands to an empty string"],
      "ruleIds": ["ACE-LORE-001", "ACE-SOURCE-001"]
    },
    {
      "id": "SRC-ST-CARD-VALIDATOR",
      "title": "SillyTavern TavernCardValidator",
      "url": "https://github.com/SillyTavern/SillyTavern/blob/8172dcd0ee672d3cd9a5e5f7af134f91a45cd2b8/src/validator/TavernCardValidator.js",
      "type": "source-code",
      "authority": "official-source",
      "revision": "8172dcd0ee672d3cd9a5e5f7af134f91a45cd2b8",
      "checkedAt": "2026-07-10",
      "reviewDue": "2026-10-08",
      "claims": ["V1 required fields", "V2 required fields and types", "V3 minimum accepted envelope"],
      "ruleIds": ["ACE-CARD-001"]
    },
    {
      "id": "SRC-ST-DOCS",
      "title": "SillyTavern World Info documentation",
      "url": "https://docs.sillytavern.app/usage/core-concepts/worldinfo/",
      "type": "documentation",
      "authority": "official-documentation",
      "revision": "checked-2026-07-10",
      "checkedAt": "2026-07-10",
      "reviewDue": "2026-10-08",
      "claims": ["World Info settings", "timed effects", "recursion and insertion concepts", "Sorted Evenly documented as default", "Outlet public behavior"],
      "ruleIds": ["ACE-SOURCE-001"]
    },
    {
      "id": "SRC-ST-REGEX-DOCS",
      "title": "SillyTavern Regex documentation",
      "url": "https://docs.sillytavern.app/extensions/regex/",
      "type": "documentation",
      "authority": "official-documentation",
      "revision": "checked-2026-07-10",
      "checkedAt": "2026-07-10",
      "reviewDue": "2026-10-08",
      "claims": ["SillyTavern regular expressions use JavaScript syntax", "regex extension scope and behavior"],
      "ruleIds": ["ACE-KEY-001"]
    },
    {
      "id": "SRC-JS-REGEX",
      "title": "MDN JavaScript regular expression guide",
      "url": "https://developer.mozilla.org/en-US/docs/Web/JavaScript/Guide/Regular_expressions",
      "type": "documentation",
      "authority": "official-documentation",
      "revision": "checked-2026-07-10",
      "checkedAt": "2026-07-10",
      "reviewDue": "2026-10-08",
      "claims": ["JavaScript regex syntax", "lookaround, flags, groups, quantifiers, and Unicode property escapes"],
      "ruleIds": ["ACE-KEY-001"]
    },
    {
      "id": "SRC-ST-VECTORS",
      "title": "SillyTavern vectors World Info implementation",
      "url": "https://github.com/SillyTavern/SillyTavern/blob/8172dcd0ee672d3cd9a5e5f7af134f91a45cd2b8/public/scripts/extensions/vectors/index.js",
      "type": "source-code",
      "authority": "official-source",
      "revision": "8172dcd0ee672d3cd9a5e5f7af134f91a45cd2b8",
      "checkedAt": "2026-07-10",
      "reviewDue": "2026-10-08",
      "claims": ["World Info entries are embedded whole", "matched entries force-activate their original content"],
      "ruleIds": ["ACE-SOURCE-001"]
    },
    {
      "id": "SRC-ACE-LORE-EXPORT",
      "title": "Bundled ACE lorebook practical rule export",
      "url": "local:references/lorebooks.md",
      "type": "bundled-rule-export",
      "authority": "local-practical-guide",
      "revision": "sha256:fe433d7bd2b55a92a328961ce16190e0b70c37dcd669252cbd3a6323be298fe1",
      "checkedAt": "2026-07-13",
      "reviewDue": "2027-01-12",
      "claims": ["self-contained practical explanations", "common lorebook errors", "workflow ergonomics", "current native numeric position anchors"],
      "ruleIds": ["ACE-LORE-004"],
      "sha256": "fe433d7bd2b55a92a328961ce16190e0b70c37dcd669252cbd3a6323be298fe1"
    },
    {
      "id": "SRC-ACE-KEY-EXPORT",
      "title": "Bundled ACE key and Russian regex rule export",
      "url": "local:references/keys-and-regex.md",
      "type": "bundled-rule-export",
      "authority": "local-practical-guide",
      "revision": "sha256:0cf32242adb96fd2532abd11a3a8aa31613fea99637ea1e5d9aef1390a4e6a01",
      "checkedAt": "2026-07-12",
      "reviewDue": "2027-01-12",
      "claims": ["self-contained key design practices", "byte-stable Russian regex specimens", "multilingual activation testing"],
      "ruleIds": ["ACE-KEY-002", "ACE-REPO-004"],
      "sha256": "0cf32242adb96fd2532abd11a3a8aa31613fea99637ea1e5d9aef1390a4e6a01"
    },
    {
      "id": "SRC-STATUO-GUIDE",
      "title": "StatuoTW's Guide to Making Bots",
      "url": "https://rentry.org/statuobotmakie",
      "type": "community-web-guide",
      "authority": "community-guide",
      "revision": "page-edited-2026-05-22",
      "checkedAt": "2026-07-12",
      "reviewDue": "2027-01-10",
      "claims": ["behavior-first character writing", "motivations", "open greetings", "dialogue examples", "testing recommendations"],
      "ruleIds": ["ACE-CARD-002", "ACE-CARD-003", "ACE-CARD-004"]
    },
    {
      "id": "SRC-AGENT-SKILLS-SPEC",
      "title": "Agent Skills specification",
      "url": "https://agentskills.io/specification",
      "type": "documentation",
      "authority": "official-documentation",
      "revision": "checked-2026-07-10",
      "checkedAt": "2026-07-10",
      "reviewDue": "2026-10-08",
      "claims": ["frontmatter", "progressive disclosure", "relative references", "validation"],
      "ruleIds": ["ACE-TRIGGER-001", "ACE-CORE-002"]
    },
    {
      "id": "SRC-AGENT-SKILLS-BEST-PRACTICES",
      "title": "Agent Skills best practices and evaluation guides",
      "url": "https://agentskills.io/skill-creation/best-practices",
      "type": "documentation",
      "authority": "official-documentation",
      "revision": "checked-2026-07-10",
      "checkedAt": "2026-07-10",
      "reviewDue": "2026-10-08",
      "claims": ["validation loops", "progressive disclosure", "eval-driven improvement"],
      "ruleIds": ["ACE-CORE-001", "ACE-CORE-004"]
    },
    {
      "id": "SRC-CODEX-SKILLS",
      "title": "Codex Build Skills documentation",
      "url": "https://learn.chatgpt.com/docs/build-skills",
      "type": "documentation",
      "authority": "official-documentation",
      "revision": "checked-2026-07-10",
      "checkedAt": "2026-07-10",
      "reviewDue": "2026-10-08",
      "claims": ["Codex activation and skill scopes"],
      "ruleIds": ["ACE-TRIGGER-001"]
    },
    {
      "id": "SRC-ANTHROPIC-SKILL-CREATOR",
      "title": "anthropics/skills skill-creator",
      "url": "https://github.com/anthropics/skills/tree/9d2f1ae187231d8199c64b5b762e1bdf2244733d/skills/skill-creator",
      "type": "source-code",
      "authority": "official-source",
      "revision": "9d2f1ae187231d8199c64b5b762e1bdf2244733d",
      "checkedAt": "2026-07-10",
      "reviewDue": "2026-10-08",
      "claims": ["baseline comparison", "fresh-context evals", "grader evidence", "description optimization"],
      "ruleIds": ["ACE-REPO-003"]
    },
    {
      "id": "SRC-OPENAI-SKILL-CREATOR",
      "title": "openai/skills skill-creator and gh-fix-ci",
      "url": "https://github.com/openai/skills/tree/49f948faa9258a0c61caceaf225e179651397431",
      "type": "source-code",
      "authority": "official-source",
      "revision": "49f948faa9258a0c61caceaf225e179651397431",
      "checkedAt": "2026-07-10",
      "reviewDue": "2026-10-08",
      "claims": ["black-box scripts", "helpful errors", "structured output", "progressive disclosure"],
      "ruleIds": ["ACE-REPO-002"]
    },
    {
      "id": "SRC-SUPERPOWERS-VERIFY",
      "title": "obra/superpowers verification-before-completion and writing-skills",
      "url": "https://github.com/obra/superpowers/tree/d884ae04edebef577e82ff7c4e143debd0bbec99/skills",
      "type": "source-code",
      "authority": "community-guide",
      "revision": "d884ae04edebef577e82ff7c4e143debd0bbec99",
      "checkedAt": "2026-07-10",
      "reviewDue": "2026-10-08",
      "claims": ["fresh verification evidence", "negative and pressure testing"],
      "ruleIds": ["ACE-CORE-003"]
    },
    {
      "id": "SRC-ACE-REQUEST",
      "title": "ACE-SKILL v5 architecture requirements",
      "url": "local:task-specification",
      "type": "task-contract",
      "authority": "observed-behavior",
      "revision": "2026-07-12",
      "checkedAt": "2026-07-12",
      "reviewDue": "2099-12-31",
      "claims": ["non-negotiable goals", "domain separation", "evidence and PASS contract", "contrastive-negation prose ban", "self-contained bundled rule exports", "narrow English-only exception boundaries", "700–1500 total-character-card token advisory with non-blocking warnings"],